Frame 1: 66 bytes on wire (528 bits), 66 bytes captured (528 bits)    Encapsulation type: Ethernet (1)    Arrival Time: Mar  5, 2015 10:20:14.356370000 CST    [Time shift for this packet: 0.000000000 seconds]    Epoch Time: 1425572414.356370000 seconds    [Time delta from previous captured frame: 0.000000000 seconds]    [Time delta from previous displayed frame: 0.000000000 seconds]    [Time since reference or first frame: 0.000000000 seconds]    Frame Number: 1    Frame Length: 66 bytes (528 bits)    Capture Length: 66 bytes (528 bits)    [Frame is marked: False]    [Frame is ignored: False]    [Protocols in frame: eth:ethertype:ip:tcp]Ethernet II, Src: ec:f4:bb:4f:b2:45, Dst: 78:54:2e:9f:10:28    Destination: 78:54:2e:9f:10:28        Address: 78:54:2e:9f:10:28        .... ..0. .... .... .... .... = LG bit: Globally unique address (factory default)        .... ...0 .... .... .... .... = IG bit: Individual address (unicast)    Source: ec:f4:bb:4f:b2:45        Address: ec:f4:bb:4f:b2:45        .... ..0. .... .... .... .... = LG bit: Globally unique address (factory default)        .... ...0 .... .... .... .... = IG bit: Individual address (unicast)    Type: IPv4 (0x0800)Internet Protocol Version 4, Src: 192.168.0.51, Dst: 80.239.174.89    0100 .... = Version: 4    .... 0101 = Header Length: 20 bytes    Differentiated Services Field: 0x00 (DSCP: CS0, ECN: Not-ECT)        0000 00.. = Differentiated Services Codepoint: Default (0)        .... ..00 = Explicit Congestion Notification: Not ECN-Capable Transport (0)    Total Length: 52    Identification: 0x8729 (34601)    Flags: 0x02 (Don't Fragment)        0... .... = Reserved bit: Not set        .1.. .... = Don't fragment: Set        ..0. .... = More fragments: Not set    Fragment offset: 0    Time to live: 64    Protocol: TCP (6)    Header checksum: 0xf376 [validation disabled]        [Good: False]        [Bad: False]    Source: 192.168.0.51    Destination: 80.239.174.89    [Source GeoIP: Unknown]    [Destination GeoIP: Unknown]Transmission Control Protocol, Src Port: 47995 (47995), Dst Port: 443 (443), Seq: 1, Ack: 1, Len: 0    Source Port: 47995    Destination Port: 443    [Stream index: 0]    [TCP Segment Len: 0]    Sequence number: 1    (relative sequence number)    Acknowledgment number: 1    (relative ack number)    Header Length: 32 bytes    Flags: 0x010 (ACK)        000. .... .... = Reserved: Not set        ...0 .... .... = Nonce: Not set        .... 0... .... = Congestion Window Reduced (CWR): Not set        .... .0.. .... = ECN-Echo: Not set        .... ..0. .... = Urgent: Not set        .... ...1 .... = Acknowledgment: Set        .... .... 0... = Push: Not set        .... .... .0.. = Reset: Not set        .... .... ..0. = Syn: Not set        .... .... ...0 = Fin: Not set        [TCP Flags: *******A****]    Window size value: 5578    [Calculated window size: 5578]    [Window size scaling factor: -1 (unknown)]    Checksum: 0x0894 [validation disabled]        [Good Checksum: False]        [Bad Checksum: False]    Urgent pointer: 0    Options: (12 bytes), No-Operation (NOP), No-Operation (NOP), Timestamps        No-Operation (NOP)            Type: 1                0... .... = Copy on fragmentation: No                .00. .... = Class: Control (0)                ...0 0001 = Number: No-Operation (NOP) (1)        No-Operation (NOP)            Type: 1                0... .... = Copy on fragmentation: No                .00. .... = Class: Control (0)                ...0 0001 = Number: No-Operation (NOP) (1)        Timestamps: TSval 1273287, TSecr 3589213310            Kind: Time Stamp Option (8)            Length: 10            Timestamp value: 1273287            Timestamp echo reply: 3589213310
Frame 2: 1454 bytes on wire (11632 bits), 1454 bytes captured (11632 bits)    Encapsulation type: Ethernet (1)    Arrival Time: Mar  5, 2015 10:20:14.356370000 CST    [Time shift for this packet: 0.000000000 seconds]    Epoch Time: 1425572414.356370000 seconds    [Time delta from previous captured frame: 0.000000000 seconds]    [Time delta from previous displayed frame: 0.000000000 seconds]    [Time since reference or first frame: 0.000000000 seconds]    Frame Number: 2    Frame Length: 1454 bytes (11632 bits)    Capture Length: 1454 bytes (11632 bits)    [Frame is marked: False]    [Frame is ignored: False]    [Protocols in frame: eth:ethertype:ip:tcp:ssl]Ethernet II, Src: 78:54:2e:9f:10:28, Dst: ec:f4:bb:4f:b2:45    Destination: ec:f4:bb:4f:b2:45        Address: ec:f4:bb:4f:b2:45        .... ..0. .... .... .... .... = LG bit: Globally unique address (factory default)        .... ...0 .... .... .... .... = IG bit: Individual address (unicast)    Source: 78:54:2e:9f:10:28        Address: 78:54:2e:9f:10:28        .... ..0. .... .... .... .... = LG bit: Globally unique address (factory default)        .... ...0 .... .... .... .... = IG bit: Individual address (unicast)    Type: IPv4 (0x0800)Internet Protocol Version 4, Src: 80.239.174.89, Dst: 192.168.0.51    0100 .... = Version: 4    .... 0101 = Header Length: 20 bytes    Differentiated Services Field: 0x00 (DSCP: CS0, ECN: Not-ECT)        0000 00.. = Differentiated Services Codepoint: Default (0)        .... ..00 = Explicit Congestion Notification: Not ECN-Capable Transport (0)    Total Length: 1440    Identification: 0x8d4b (36171)    Flags: 0x00        0... .... = Reserved bit: Not set        .0.. .... = Don't fragment: Not set        ..0. .... = More fragments: Not set    Fragment offset: 0    Time to live: 51    Protocol: TCP (6)    Header checksum: 0x34e9 [validation disabled]        [Good: False]        [Bad: False]    Source: 80.239.174.89    Destination: 192.168.0.51    [Source GeoIP: Unknown]    [Destination GeoIP: Unknown]Transmission Control Protocol, Src Port: 443 (443), Dst Port: 47995 (47995), Seq: 1, Ack: 4294967236, Len: 1388    Source Port: 443    Destination Port: 47995    [Stream index: 0]    [TCP Segment Len: 1388]    Sequence number: 1    (relative sequence number)    [Next sequence number: 1389    (relative sequence number)]    Acknowledgment number: 4294967236    (relative ack number)    Header Length: 32 bytes    Flags: 0x010 (ACK)        000. .... .... = Reserved: Not set        ...0 .... .... = Nonce: Not set        .... 0... .... = Congestion Window Reduced (CWR): Not set        .... .0.. .... = ECN-Echo: Not set        .... ..0. .... = Urgent: Not set        .... ...1 .... = Acknowledgment: Set        .... .... 0... = Push: Not set        .... .... .0.. = Reset: Not set        .... .... ..0. = Syn: Not set        .... .... ...0 = Fin: Not set        [TCP Flags: *******A****]    Window size value: 777    [Calculated window size: 777]    [Window size scaling factor: -1 (unknown)]    Checksum: 0x0ece [validation disabled]        [Good Checksum: False]        [Bad Checksum: False]    Urgent pointer: 0    Options: (12 bytes), No-Operation (NOP), No-Operation (NOP), Timestamps        No-Operation (NOP)            Type: 1                0... .... = Copy on fragmentation: No                .00. .... = Class: Control (0)                ...0 0001 = Number: No-Operation (NOP) (1)        No-Operation (NOP)            Type: 1                0... .... = Copy on fragmentation: No                .00. .... = Class: Control (0)                ...0 0001 = Number: No-Operation (NOP) (1)        Timestamps: TSval 3589213311, TSecr 1273267            Kind: Time Stamp Option (8)            Length: 10            Timestamp value: 3589213311            Timestamp echo reply: 1273267    [SEQ/ACK analysis]        [Bytes in flight: 1388]Secure Sockets Layer
Frame 3: 1454 bytes on wire (11632 bits), 1454 bytes captured (11632 bits)    Encapsulation type: Ethernet (1)    Arrival Time: Mar  5, 2015 10:20:14.356370000 CST    [Time shift for this packet: 0.000000000 seconds]    Epoch Time: 1425572414.356370000 seconds    [Time delta from previous captured frame: 0.000000000 seconds]    [Time delta from previous displayed frame: 0.000000000 seconds]    [Time since reference or first frame: 0.000000000 seconds]    Frame Number: 3    Frame Length: 1454 bytes (11632 bits)    Capture Length: 1454 bytes (11632 bits)    [Frame is marked: False]    [Frame is ignored: False]    [Protocols in frame: eth:ethertype:ip:tcp:ssl]Ethernet II, Src: 78:54:2e:9f:10:28, Dst: ec:f4:bb:4f:b2:45    Destination: ec:f4:bb:4f:b2:45        Address: ec:f4:bb:4f:b2:45        .... ..0. .... .... .... .... = LG bit: Globally unique address (factory default)        .... ...0 .... .... .... .... = IG bit: Individual address (unicast)    Source: 78:54:2e:9f:10:28        Address: 78:54:2e:9f:10:28        .... ..0. .... .... .... .... = LG bit: Globally unique address (factory default)        .... ...0 .... .... .... .... = IG bit: Individual address (unicast)    Type: IPv4 (0x0800)Internet Protocol Version 4, Src: 80.239.174.89, Dst: 192.168.0.51    0100 .... = Version: 4    .... 0101 = Header Length: 20 bytes    Differentiated Services Field: 0x00 (DSCP: CS0, ECN: Not-ECT)        0000 00.. = Differentiated Services Codepoint: Default (0)        .... ..00 = Explicit Congestion Notification: Not ECN-Capable Transport (0)    Total Length: 1440    Identification: 0x8d4c (36172)    Flags: 0x00        0... .... = Reserved bit: Not set        .0.. .... = Don't fragment: Not set        ..0. .... = More fragments: Not set    Fragment offset: 0    Time to live: 51    Protocol: TCP (6)    Header checksum: 0x34e8 [validation disabled]        [Good: False]        [Bad: False]    Source: 80.239.174.89    Destination: 192.168.0.51    [Source GeoIP: Unknown]    [Destination GeoIP: Unknown]Transmission Control Protocol, Src Port: 443 (443), Dst Port: 47995 (47995), Seq: 1389, Ack: 4294967236, Len: 1388    Source Port: 443    Destination Port: 47995    [Stream index: 0]    [TCP Segment Len: 1388]    Sequence number: 1389    (relative sequence number)    [Next sequence number: 2777    (relative sequence number)]    Acknowledgment number: 4294967236    (relative ack number)    Header Length: 32 bytes    Flags: 0x010 (ACK)        000. .... .... = Reserved: Not set        ...0 .... .... = Nonce: Not set        .... 0... .... = Congestion Window Reduced (CWR): Not set        .... .0.. .... = ECN-Echo: Not set        .... ..0. .... = Urgent: Not set        .... ...1 .... = Acknowledgment: Set        .... .... 0... = Push: Not set        .... .... .0.. = Reset: Not set        .... .... ..0. = Syn: Not set        .... .... ...0 = Fin: Not set        [TCP Flags: *******A****]    Window size value: 777    [Calculated window size: 777]    [Window size scaling factor: -1 (unknown)]    Checksum: 0x7c5d [validation disabled]        [Good Checksum: False]        [Bad Checksum: False]    Urgent pointer: 0    Options: (12 bytes), No-Operation (NOP), No-Operation (NOP), Timestamps        No-Operation (NOP)            Type: 1                0... .... = Copy on fragmentation: No                .00. .... = Class: Control (0)                ...0 0001 = Number: No-Operation (NOP) (1)        No-Operation (NOP)            Type: 1                0... .... = Copy on fragmentation: No                .00. .... = Class: Control (0)                ...0 0001 = Number: No-Operation (NOP) (1)        Timestamps: TSval 3589213311, TSecr 1273267            Kind: Time Stamp Option (8)            Length: 10            Timestamp value: 3589213311            Timestamp echo reply: 1273267    [SEQ/ACK analysis]        [Bytes in flight: 2776]Secure Sockets Layer
Frame 4: 66 bytes on wire (528 bits), 66 bytes captured (528 bits)    Encapsulation type: Ethernet (1)    Arrival Time: Mar  5, 2015 10:20:14.357028000 CST    [Time shift for this packet: 0.000000000 seconds]    Epoch Time: 1425572414.357028000 seconds    [Time delta from previous captured frame: 0.000658000 seconds]    [Time delta from previous displayed frame: 0.000658000 seconds]    [Time since reference or first frame: 0.000658000 seconds]    Frame Number: 4    Frame Length: 66 bytes (528 bits)    Capture Length: 66 bytes (528 bits)    [Frame is marked: False]    [Frame is ignored: False]    [Protocols in frame: eth:ethertype:ip:tcp]Ethernet II, Src: ec:f4:bb:4f:b2:45, Dst: 78:54:2e:9f:10:28    Destination: 78:54:2e:9f:10:28        Address: 78:54:2e:9f:10:28        .... ..0. .... .... .... .... = LG bit: Globally unique address (factory default)        .... ...0 .... .... .... .... = IG bit: Individual address (unicast)    Source: ec:f4:bb:4f:b2:45        Address: ec:f4:bb:4f:b2:45        .... ..0. .... .... .... .... = LG bit: Globally unique address (factory default)        .... ...0 .... .... .... .... = IG bit: Individual address (unicast)    Type: IPv4 (0x0800)Internet Protocol Version 4, Src: 192.168.0.51, Dst: 80.239.174.89    0100 .... = Version: 4    .... 0101 = Header Length: 20 bytes    Differentiated Services Field: 0x00 (DSCP: CS0, ECN: Not-ECT)        0000 00.. = Differentiated Services Codepoint: Default (0)        .... ..00 = Explicit Congestion Notification: Not ECN-Capable Transport (0)    Total Length: 52    Identification: 0x872a (34602)    Flags: 0x02 (Don't Fragment)        0... .... = Reserved bit: Not set        .1.. .... = Don't fragment: Set        ..0. .... = More fragments: Not set    Fragment offset: 0    Time to live: 64    Protocol: TCP (6)    Header checksum: 0xf375 [validation disabled]        [Good: False]        [Bad: False]    Source: 192.168.0.51    Destination: 80.239.174.89    [Source GeoIP: Unknown]    [Destination GeoIP: Unknown]Transmission Control Protocol, Src Port: 47995 (47995), Dst Port: 443 (443), Seq: 1, Ack: 2777, Len: 0    Source Port: 47995    Destination Port: 443    [Stream index: 0]    [TCP Segment Len: 0]    Sequence number: 1    (relative sequence number)    Acknowledgment number: 2777    (relative ack number)    Header Length: 32 bytes    Flags: 0x010 (ACK)        000. .... .... = Reserved: Not set        ...0 .... .... = Nonce: Not set        .... 0... .... = Congestion Window Reduced (CWR): Not set        .... .0.. .... = ECN-Echo: Not set        .... ..0. .... = Urgent: Not set        .... ...1 .... = Acknowledgment: Set        .... .... 0... = Push: Not set        .... .... .0.. = Reset: Not set        .... .... ..0. = Syn: Not set        .... .... ...0 = Fin: Not set        [TCP Flags: *******A****]    Window size value: 5578    [Calculated window size: 5578]    [Window size scaling factor: -1 (unknown)]    Checksum: 0xfdba [validation disabled]        [Good Checksum: False]        [Bad Checksum: False]    Urgent pointer: 0    Options: (12 bytes), No-Operation (NOP), No-Operation (NOP), Timestamps        No-Operation (NOP)            Type: 1                0... .... = Copy on fragmentation: No                .00. .... = Class: Control (0)                ...0 0001 = Number: No-Operation (NOP) (1)        No-Operation (NOP)            Type: 1                0... .... = Copy on fragmentation: No                .00. .... = Class: Control (0)                ...0 0001 = Number: No-Operation (NOP) (1)        Timestamps: TSval 1273287, TSecr 3589213311            Kind: Time Stamp Option (8)            Length: 10            Timestamp value: 1273287            Timestamp echo reply: 3589213311    [SEQ/ACK analysis]        [This is an ACK to the segment in frame: 3]        [The RTT to ACK the segment was: 0.000658000 seconds]
Frame 5: 1454 bytes on wire (11632 bits), 1454 bytes captured (11632 bits)    Encapsulation type: Ethernet (1)    Arrival Time: Mar  5, 2015 10:20:14.357032000 CST    [Time shift for this packet: 0.000000000 seconds]    Epoch Time: 1425572414.357032000 seconds    [Time delta from previous captured frame: 0.000004000 seconds]    [Time delta from previous displayed frame: 0.000004000 seconds]    [Time since reference or first frame: 0.000662000 seconds]    Frame Number: 5    Frame Length: 1454 bytes (11632 bits)    Capture Length: 1454 bytes (11632 bits)    [Frame is marked: False]    [Frame is ignored: False]    [Protocols in frame: eth:ethertype:ip:tcp:ssl]Ethernet II, Src: 78:54:2e:9f:10:28, Dst: ec:f4:bb:4f:b2:45    Destination: ec:f4:bb:4f:b2:45        Address: ec:f4:bb:4f:b2:45        .... ..0. .... .... .... .... = LG bit: Globally unique address (factory default)        .... ...0 .... .... .... .... = IG bit: Individual address (unicast)    Source: 78:54:2e:9f:10:28        Address: 78:54:2e:9f:10:28        .... ..0. .... .... .... .... = LG bit: Globally unique address (factory default)        .... ...0 .... .... .... .... = IG bit: Individual address (unicast)    Type: IPv4 (0x0800)Internet Protocol Version 4, Src: 80.239.174.89, Dst: 192.168.0.51    0100 .... = Version: 4    .... 0101 = Header Length: 20 bytes    Differentiated Services Field: 0x00 (DSCP: CS0, ECN: Not-ECT)        0000 00.. = Differentiated Services Codepoint: Default (0)        .... ..00 = Explicit Congestion Notification: Not ECN-Capable Transport (0)    Total Length: 1440    Identification: 0x8d4d (36173)    Flags: 0x00        0... .... = Reserved bit: Not set        .0.. .... = Don't fragment: Not set        ..0. .... = More fragments: Not set    Fragment offset: 0    Time to live: 51    Protocol: TCP (6)    Header checksum: 0x34e7 [validation disabled]        [Good: False]        [Bad: False]    Source: 80.239.174.89    Destination: 192.168.0.51    [Source GeoIP: Unknown]    [Destination GeoIP: Unknown]Transmission Control Protocol, Src Port: 443 (443), Dst Port: 47995 (47995), Seq: 2777, Ack: 4294967236, Len: 1388    Source Port: 443    Destination Port: 47995    [Stream index: 0]    [TCP Segment Len: 1388]    Sequence number: 2777    (relative sequence number)    [Next sequence number: 4165    (relative sequence number)]    Acknowledgment number: 4294967236    (relative ack number)    Header Length: 32 bytes    Flags: 0x010 (ACK)        000. .... .... = Reserved: Not set        ...0 .... .... = Nonce: Not set        .... 0... .... = Congestion Window Reduced (CWR): Not set        .... .0.. .... = ECN-Echo: Not set        .... ..0. .... = Urgent: Not set        .... ...1 .... = Acknowledgment: Set        .... .... 0... = Push: Not set        .... .... .0.. = Reset: Not set        .... .... ..0. = Syn: Not set        .... .... ...0 = Fin: Not set        [TCP Flags: *******A****]    Window size value: 777    [Calculated window size: 777]    [Window size scaling factor: -1 (unknown)]    Checksum: 0x2877 [validation disabled]        [Good Checksum: False]        [Bad Checksum: False]    Urgent pointer: 0    Options: (12 bytes), No-Operation (NOP), No-Operation (NOP), Timestamps        No-Operation (NOP)            Type: 1                0... .... = Copy on fragmentation: No                .00. .... = Class: Control (0)                ...0 0001 = Number: No-Operation (NOP) (1)        No-Operation (NOP)            Type: 1                0... .... = Copy on fragmentation: No                .00. .... = Class: Control (0)                ...0 0001 = Number: No-Operation (NOP) (1)        Timestamps: TSval 3589213311, TSecr 1273267            Kind: Time Stamp Option (8)            Length: 10            Timestamp value: 3589213311            Timestamp echo reply: 1273267    [SEQ/ACK analysis]        [Bytes in flight: 1388]Secure Sockets Layer
Frame 6: 1454 bytes on wire (11632 bits), 1454 bytes captured (11632 bits)    Encapsulation type: Ethernet (1)    Arrival Time: Mar  5, 2015 10:20:14.357035000 CST    [Time shift for this packet: 0.000000000 seconds]    Epoch Time: 1425572414.357035000 seconds    [Time delta from previous captured frame: 0.000003000 seconds]    [Time delta from previous displayed frame: 0.000003000 seconds]    [Time since reference or first frame: 0.000665000 seconds]    Frame Number: 6    Frame Length: 1454 bytes (11632 bits)    Capture Length: 1454 bytes (11632 bits)    [Frame is marked: False]    [Frame is ignored: False]    [Protocols in frame: eth:ethertype:ip:tcp:ssl]Ethernet II, Src: 78:54:2e:9f:10:28, Dst: ec:f4:bb:4f:b2:45    Destination: ec:f4:bb:4f:b2:45        Address: ec:f4:bb:4f:b2:45        .... ..0. .... .... .... .... = LG bit: Globally unique address (factory default)        .... ...0 .... .... .... .... = IG bit: Individual address (unicast)    Source: 78:54:2e:9f:10:28        Address: 78:54:2e:9f:10:28        .... ..0. .... .... .... .... = LG bit: Globally unique address (factory default)        .... ...0 .... .... .... .... = IG bit: Individual address (unicast)    Type: IPv4 (0x0800)Internet Protocol Version 4, Src: 80.239.174.89, Dst: 192.168.0.51    0100 .... = Version: 4    .... 0101 = Header Length: 20 bytes    Differentiated Services Field: 0x00 (DSCP: CS0, ECN: Not-ECT)        0000 00.. = Differentiated Services Codepoint: Default (0)        .... ..00 = Explicit Congestion Notification: Not ECN-Capable Transport (0)    Total Length: 1440    Identification: 0x8d4e (36174)    Flags: 0x00        0... .... = Reserved bit: Not set        .0.. .... = Don't fragment: Not set        ..0. .... = More fragments: Not set    Fragment offset: 0    Time to live: 51    Protocol: TCP (6)    Header checksum: 0x34e6 [validation disabled]        [Good: False]        [Bad: False]    Source: 80.239.174.89    Destination: 192.168.0.51    [Source GeoIP: Unknown]    [Destination GeoIP: Unknown]Transmission Control Protocol, Src Port: 443 (443), Dst Port: 47995 (47995), Seq: 4165, Ack: 4294967236, Len: 1388    Source Port: 443    Destination Port: 47995    [Stream index: 0]    [TCP Segment Len: 1388]    Sequence number: 4165    (relative sequence number)    [Next sequence number: 5553    (relative sequence number)]    Acknowledgment number: 4294967236    (relative ack number)    Header Length: 32 bytes    Flags: 0x010 (ACK)        000. .... .... = Reserved: Not set        ...0 .... .... = Nonce: Not set        .... 0... .... = Congestion Window Reduced (CWR): Not set        .... .0.. .... = ECN-Echo: Not set        .... ..0. .... = Urgent: Not set        .... ...1 .... = Acknowledgment: Set        .... .... 0... = Push: Not set        .... .... .0.. = Reset: Not set        .... .... ..0. = Syn: Not set        .... .... ...0 = Fin: Not set        [TCP Flags: *******A****]    Window size value: 777    [Calculated window size: 777]    [Window size scaling factor: -1 (unknown)]    Checksum: 0x77bf [validation disabled]        [Good Checksum: False]        [Bad Checksum: False]    Urgent pointer: 0    Options: (12 bytes), No-Operation (NOP), No-Operation (NOP), Timestamps        No-Operation (NOP)            Type: 1                0... .... = Copy on fragmentation: No                .00. .... = Class: Control (0)                ...0 0001 = Number: No-Operation (NOP) (1)        No-Operation (NOP)            Type: 1                0... .... = Copy on fragmentation: No                .00. .... = Class: Control (0)                ...0 0001 = Number: No-Operation (NOP) (1)        Timestamps: TSval 3589213311, TSecr 1273267            Kind: Time Stamp Option (8)            Length: 10            Timestamp value: 3589213311            Timestamp echo reply: 1273267    [SEQ/ACK analysis]        [Bytes in flight: 2776]Secure Sockets Layer
Frame 7: 66 bytes on wire (528 bits), 66 bytes captured (528 bits)    Encapsulation type: Ethernet (1)    Arrival Time: Mar  5, 2015 10:20:14.357111000 CST    [Time shift for this packet: 0.000000000 seconds]    Epoch Time: 1425572414.357111000 seconds    [Time delta from previous captured frame: 0.000076000 seconds]    [Time delta from previous displayed frame: 0.000076000 seconds]    [Time since reference or first frame: 0.000741000 seconds]    Frame Number: 7    Frame Length: 66 bytes (528 bits)    Capture Length: 66 bytes (528 bits)    [Frame is marked: False]    [Frame is ignored: False]    [Protocols in frame: eth:ethertype:ip:tcp]Ethernet II, Src: ec:f4:bb:4f:b2:45, Dst: 78:54:2e:9f:10:28    Destination: 78:54:2e:9f:10:28        Address: 78:54:2e:9f:10:28        .... ..0. .... .... .... .... = LG bit: Globally unique address (factory default)        .... ...0 .... .... .... .... = IG bit: Individual address (unicast)    Source: ec:f4:bb:4f:b2:45        Address: ec:f4:bb:4f:b2:45        .... ..0. .... .... .... .... = LG bit: Globally unique address (factory default)        .... ...0 .... .... .... .... = IG bit: Individual address (unicast)    Type: IPv4 (0x0800)Internet Protocol Version 4, Src: 192.168.0.51, Dst: 80.239.174.89    0100 .... = Version: 4    .... 0101 = Header Length: 20 bytes    Differentiated Services Field: 0x00 (DSCP: CS0, ECN: Not-ECT)        0000 00.. = Differentiated Services Codepoint: Default (0)        .... ..00 = Explicit Congestion Notification: Not ECN-Capable Transport (0)    Total Length: 52    Identification: 0x872b (34603)    Flags: 0x02 (Don't Fragment)        0... .... = Reserved bit: Not set        .1.. .... = Don't fragment: Set        ..0. .... = More fragments: Not set    Fragment offset: 0    Time to live: 64    Protocol: TCP (6)    Header checksum: 0xf374 [validation disabled]        [Good: False]        [Bad: False]    Source: 192.168.0.51    Destination: 80.239.174.89    [Source GeoIP: Unknown]    [Destination GeoIP: Unknown]Transmission Control Protocol, Src Port: 47995 (47995), Dst Port: 443 (443), Seq: 1, Ack: 5553, Len: 0    Source Port: 47995    Destination Port: 443    [Stream index: 0]    [TCP Segment Len: 0]    Sequence number: 1    (relative sequence number)    Acknowledgment number: 5553    (relative ack number)    Header Length: 32 bytes    Flags: 0x010 (ACK)        000. .... .... = Reserved: Not set        ...0 .... .... = Nonce: Not set        .... 0... .... = Congestion Window Reduced (CWR): Not set        .... .0.. .... = ECN-Echo: Not set        .... ..0. .... = Urgent: Not set        .... ...1 .... = Acknowledgment: Set        .... .... 0... = Push: Not set        .... .... .0.. = Reset: Not set        .... .... ..0. = Syn: Not set        .... .... ...0 = Fin: Not set        [TCP Flags: *******A****]    Window size value: 5578    [Calculated window size: 5578]    [Window size scaling factor: -1 (unknown)]    Checksum: 0xf2e2 [validation disabled]        [Good Checksum: False]        [Bad Checksum: False]    Urgent pointer: 0    Options: (12 bytes), No-Operation (NOP), No-Operation (NOP), Timestamps        No-Operation (NOP)            Type: 1                0... .... = Copy on fragmentation: No                .00. .... = Class: Control (0)                ...0 0001 = Number: No-Operation (NOP) (1)        No-Operation (NOP)            Type: 1                0... .... = Copy on fragmentation: No                .00. .... = Class: Control (0)                ...0 0001 = Number: No-Operation (NOP) (1)        Timestamps: TSval 1273287, TSecr 3589213311            Kind: Time Stamp Option (8)            Length: 10            Timestamp value: 1273287            Timestamp echo reply: 3589213311    [SEQ/ACK analysis]        [This is an ACK to the segment in frame: 6]        [The RTT to ACK the segment was: 0.000076000 seconds]
Frame 8: 1454 bytes on wire (11632 bits), 1454 bytes captured (11632 bits)    Encapsulation type: Ethernet (1)    Arrival Time: Mar  5, 2015 10:20:14.357116000 CST    [Time shift for this packet: 0.000000000 seconds]    Epoch Time: 1425572414.357116000 seconds    [Time delta from previous captured frame: 0.000005000 seconds]    [Time delta from previous displayed frame: 0.000005000 seconds]    [Time since reference or first frame: 0.000746000 seconds]    Frame Number: 8    Frame Length: 1454 bytes (11632 bits)    Capture Length: 1454 bytes (11632 bits)    [Frame is marked: False]    [Frame is ignored: False]    [Protocols in frame: eth:ethertype:ip:tcp:ssl]Ethernet II, Src: 78:54:2e:9f:10:28, Dst: ec:f4:bb:4f:b2:45    Destination: ec:f4:bb:4f:b2:45        Address: ec:f4:bb:4f:b2:45        .... ..0. .... .... .... .... = LG bit: Globally unique address (factory default)        .... ...0 .... .... .... .... = IG bit: Individual address (unicast)    Source: 78:54:2e:9f:10:28        Address: 78:54:2e:9f:10:28        .... ..0. .... .... .... .... = LG bit: Globally unique address (factory default)        .... ...0 .... .... .... .... = IG bit: Individual address (unicast)    Type: IPv4 (0x0800)Internet Protocol Version 4, Src: 80.239.174.89, Dst: 192.168.0.51    0100 .... = Version: 4    .... 0101 = Header Length: 20 bytes    Differentiated Services Field: 0x00 (DSCP: CS0, ECN: Not-ECT)        0000 00.. = Differentiated Services Codepoint: Default (0)        .... ..00 = Explicit Congestion Notification: Not ECN-Capable Transport (0)    Total Length: 1440    Identification: 0x8d4f (36175)    Flags: 0x00        0... .... = Reserved bit: Not set        .0.. .... = Don't fragment: Not set        ..0. .... = More fragments: Not set    Fragment offset: 0    Time to live: 51    Protocol: TCP (6)    Header checksum: 0x34e5 [validation disabled]        [Good: False]        [Bad: False]    Source: 80.239.174.89    Destination: 192.168.0.51    [Source GeoIP: Unknown]    [Destination GeoIP: Unknown]Transmission Control Protocol, Src Port: 443 (443), Dst Port: 47995 (47995), Seq: 5553, Ack: 4294967236, Len: 1388    Source Port: 443    Destination Port: 47995    [Stream index: 0]    [TCP Segment Len: 1388]    Sequence number: 5553    (relative sequence number)    [Next sequence number: 6941    (relative sequence number)]    Acknowledgment number: 4294967236    (relative ack number)    Header Length: 32 bytes    Flags: 0x010 (ACK)        000. .... .... = Reserved: Not set        ...0 .... .... = Nonce: Not set        .... 0... .... = Congestion Window Reduced (CWR): Not set        .... .0.. .... = ECN-Echo: Not set        .... ..0. .... = Urgent: Not set        .... ...1 .... = Acknowledgment: Set        .... .... 0... = Push: Not set        .... .... .0.. = Reset: Not set        .... .... ..0. = Syn: Not set        .... .... ...0 = Fin: Not set        [TCP Flags: *******A****]    Window size value: 777    [Calculated window size: 777]    [Window size scaling factor: -1 (unknown)]    Checksum: 0xaeb8 [validation disabled]        [Good Checksum: False]        [Bad Checksum: False]    Urgent pointer: 0    Options: (12 bytes), No-Operation (NOP), No-Operation (NOP), Timestamps        No-Operation (NOP)            Type: 1                0... .... = Copy on fragmentation: No                .00. .... = Class: Control (0)                ...0 0001 = Number: No-Operation (NOP) (1)        No-Operation (NOP)            Type: 1                0... .... = Copy on fragmentation: No                .00. .... = Class: Control (0)                ...0 0001 = Number: No-Operation (NOP) (1)        Timestamps: TSval 3589213314, TSecr 1273267            Kind: Time Stamp Option (8)            Length: 10            Timestamp value: 3589213314            Timestamp echo reply: 1273267    [SEQ/ACK analysis]        [Bytes in flight: 1388]Secure Sockets Layer
Frame 9: 66 bytes on wire (528 bits), 66 bytes captured (528 bits)    Encapsulation type: Ethernet (1)    Arrival Time: Mar  5, 2015 10:20:14.357534000 CST    [Time shift for this packet: 0.000000000 seconds]    Epoch Time: 1425572414.357534000 seconds    [Time delta from previous captured frame: 0.000418000 seconds]    [Time delta from previous displayed frame: 0.000418000 seconds]    [Time since reference or first frame: 0.001164000 seconds]    Frame Number: 9    Frame Length: 66 bytes (528 bits)    Capture Length: 66 bytes (528 bits)    [Frame is marked: False]    [Frame is ignored: False]    [Protocols in frame: eth:ethertype:ip:tcp]Ethernet II, Src: ec:f4:bb:4f:b2:45, Dst: 78:54:2e:9f:10:28    Destination: 78:54:2e:9f:10:28        Address: 78:54:2e:9f:10:28        .... ..0. .... .... .... .... = LG bit: Globally unique address (factory default)        .... ...0 .... .... .... .... = IG bit: Individual address (unicast)    Source: ec:f4:bb:4f:b2:45        Address: ec:f4:bb:4f:b2:45        .... ..0. .... .... .... .... = LG bit: Globally unique address (factory default)        .... ...0 .... .... .... .... = IG bit: Individual address (unicast)    Type: IPv4 (0x0800)Internet Protocol Version 4, Src: 192.168.0.51, Dst: 80.239.174.89    0100 .... = Version: 4    .... 0101 = Header Length: 20 bytes    Differentiated Services Field: 0x00 (DSCP: CS0, ECN: Not-ECT)        0000 00.. = Differentiated Services Codepoint: Default (0)        .... ..00 = Explicit Congestion Notification: Not ECN-Capable Transport (0)    Total Length: 52    Identification: 0x872c (34604)    Flags: 0x02 (Don't Fragment)        0... .... = Reserved bit: Not set        .1.. .... = Don't fragment: Set        ..0. .... = More fragments: Not set    Fragment offset: 0    Time to live: 64    Protocol: TCP (6)    Header checksum: 0xf373 [validation disabled]        [Good: False]        [Bad: False]    Source: 192.168.0.51    Destination: 80.239.174.89    [Source GeoIP: Unknown]    [Destination GeoIP: Unknown]Transmission Control Protocol, Src Port: 47995 (47995), Dst Port: 443 (443), Seq: 1, Ack: 8329, Len: 0    Source Port: 47995    Destination Port: 443    [Stream index: 0]    [TCP Segment Len: 0]    Sequence number: 1    (relative sequence number)    Acknowledgment number: 8329    (relative ack number)    Header Length: 32 bytes    Flags: 0x010 (ACK)        000. .... .... = Reserved: Not set        ...0 .... .... = Nonce: Not set        .... 0... .... = Congestion Window Reduced (CWR): Not set        .... .0.. .... = ECN-Echo: Not set        .... ..0. .... = Urgent: Not set        .... ...1 .... = Acknowledgment: Set        .... .... 0... = Push: Not set        .... .... .0.. = Reset: Not set        .... .... ..0. = Syn: Not set        .... .... ...0 = Fin: Not set        [TCP Flags: *******A****]    Window size value: 5578    [Calculated window size: 5578]    [Window size scaling factor: -1 (unknown)]    Checksum: 0xe807 [validation disabled]        [Good Checksum: False]        [Bad Checksum: False]    Urgent pointer: 0    Options: (12 bytes), No-Operation (NOP), No-Operation (NOP), Timestamps        No-Operation (NOP)            Type: 1                0... .... = Copy on fragmentation: No                .00. .... = Class: Control (0)                ...0 0001 = Number: No-Operation (NOP) (1)        No-Operation (NOP)            Type: 1                0... .... = Copy on fragmentation: No                .00. .... = Class: Control (0)                ...0 0001 = Number: No-Operation (NOP) (1)        Timestamps: TSval 1273287, TSecr 3589213314            Kind: Time Stamp Option (8)            Length: 10            Timestamp value: 1273287            Timestamp echo reply: 3589213314    [SEQ/ACK analysis]        [TCP Analysis Flags]            [Expert Info (Warn/Sequence): ACKed segment that wasn't captured (common at capture start)]                [ACKed segment that wasn't captured (common at capture start)]                [Severity level: Warn]                [Group: Sequence]
Frame 10: 1454 bytes on wire (11632 bits), 1454 bytes captured (11632 bits)    Encapsulation type: Ethernet (1)    Arrival Time: Mar  5, 2015 10:20:14.357539000 CST    [Time shift for this packet: 0.000000000 seconds]    Epoch Time: 1425572414.357539000 seconds    [Time delta from previous captured frame: 0.000005000 seconds]    [Time delta from previous displayed frame: 0.000005000 seconds]    [Time since reference or first frame: 0.001169000 seconds]    Frame Number: 10    Frame Length: 1454 bytes (11632 bits)    Capture Length: 1454 bytes (11632 bits)    [Frame is marked: False]    [Frame is ignored: False]    [Protocols in frame: eth:ethertype:ip:tcp:ssl]Ethernet II, Src: 78:54:2e:9f:10:28, Dst: ec:f4:bb:4f:b2:45    Destination: ec:f4:bb:4f:b2:45        Address: ec:f4:bb:4f:b2:45        .... ..0. .... .... .... .... = LG bit: Globally unique address (factory default)        .... ...0 .... .... .... .... = IG bit: Individual address (unicast)    Source: 78:54:2e:9f:10:28        Address: 78:54:2e:9f:10:28        .... ..0. .... .... .... .... = LG bit: Globally unique address (factory default)        .... ...0 .... .... .... .... = IG bit: Individual address (unicast)    Type: IPv4 (0x0800)Internet Protocol Version 4, Src: 80.239.174.89, Dst: 192.168.0.51    0100 .... = Version: 4    .... 0101 = Header Length: 20 bytes    Differentiated Services Field: 0x00 (DSCP: CS0, ECN: Not-ECT)        0000 00.. = Differentiated Services Codepoint: Default (0)        .... ..00 = Explicit Congestion Notification: Not ECN-Capable Transport (0)    Total Length: 1440    Identification: 0x8d50 (36176)    Flags: 0x00        0... .... = Reserved bit: Not set        .0.. .... = Don't fragment: Not set        ..0. .... = More fragments: Not set    Fragment offset: 0    Time to live: 51    Protocol: TCP (6)    Header checksum: 0x34e4 [validation disabled]        [Good: False]        [Bad: False]    Source: 80.239.174.89    Destination: 192.168.0.51    [Source GeoIP: Unknown]    [Destination GeoIP: Unknown]Transmission Control Protocol, Src Port: 443 (443), Dst Port: 47995 (47995), Seq: 6941, Ack: 4294967236, Len: 1388    Source Port: 443    Destination Port: 47995    [Stream index: 0]    [TCP Segment Len: 1388]    Sequence number: 6941    (relative sequence number)    [Next sequence number: 8329    (relative sequence number)]    Acknowledgment number: 4294967236    (relative ack number)    Header Length: 32 bytes    Flags: 0x010 (ACK)        000. .... .... = Reserved: Not set        ...0 .... .... = Nonce: Not set        .... 0... .... = Congestion Window Reduced (CWR): Not set        .... .0.. .... = ECN-Echo: Not set        .... ..0. .... = Urgent: Not set        .... ...1 .... = Acknowledgment: Set        .... .... 0... = Push: Not set        .... .... .0.. = Reset: Not set        .... .... ..0. = Syn: Not set        .... .... ...0 = Fin: Not set        [TCP Flags: *******A****]    Window size value: 777    [Calculated window size: 777]    [Window size scaling factor: -1 (unknown)]    Checksum: 0x9d51 [validation disabled]        [Good Checksum: False]        [Bad Checksum: False]    Urgent pointer: 0    Options: (12 bytes), No-Operation (NOP), No-Operation (NOP), Timestamps        No-Operation (NOP)            Type: 1                0... .... = Copy on fragmentation: No                .00. .... = Class: Control (0)                ...0 0001 = Number: No-Operation (NOP) (1)        No-Operation (NOP)            Type: 1                0... .... = Copy on fragmentation: No                .00. .... = Class: Control (0)                ...0 0001 = Number: No-Operation (NOP) (1)        Timestamps: TSval 3589213314, TSecr 1273267            Kind: Time Stamp Option (8)            Length: 10            Timestamp value: 3589213314            Timestamp echo reply: 1273267    [SEQ/ACK analysis]        [Bytes in flight: 1388]Secure Sockets Layer
